{
  "header": {
    "format_version": 0.2,
    "format_revision": 0,
    "case_name": "TwoBusIeeet1",
    "case_description": "A two-bus test case for demonstrating the dynamics format",
    "case_comments": "Monitors Bus_1 voltage magnitude, machine speed, and exciter field voltage."
  },
  "params": {
    "freq_base": 60.0,
    "va_base": 100000000.0
  },
  "monitors": [
    {
      "file_name": "mon.csv",
      "format": "csv"
    }
  ],
  "buses": [
    {
      "number": 0,
      "class": "Bus",
      "name": "Bus 1",
      "params": {
        "kv": 115.0
      },
      "mon": [
        "Vm"
      ]
    },
    {
      "number": 1,
      "class": "BusInfinite",
      "name": "Bus 2",
      "params": {
        "kv": 115.0
      }
    }
  ],
  "signals": [
    {
      "signal_id": 0,
      "name": "Machine Speed Deviation"
    },
    {
      "signal_id": 1,
      "name": "Mechanical Power"
    },
    {
      "signal_id": 2,
      "name": "Excitation Field"
    }
  ],
  "devices": [
    {
      "class": "Branch",
      "ports": {
        "bus1": 0,
        "bus2": 1
      },
      "id": "BR1",
      "params": {
        "R": 0.0,
        "X": 0.1,
        "G": 0.0,
        "B": 0.0
      }
    },
    {
      "class": "Genrou",
      "ports": {
        "bus": 0,
        "speed": 0,
        "pmech": 1,
        "efd": 2
      },
      "id": "DV1",
      "params": {
        "H": 3.0,
        "D": 0.0,
        "Ra": 0.0,
        "Tdop": 7.0,
        "Tdopp": 0.04,
        "Tqopp": 0.05,
        "Tqop": 0.75,
        "Xd": 2.1,
        "Xdp": 0.2,
        "Xdpp": 0.18,
        "Xq": 0.5,
        "Xqp": 0.5,
        "Xqpp": 0.18,
        "Xl": 0.15,
        "S10": 0.0,
        "S12": 0.0,
        "mva": 100.0
      },
      "mon": [
        "speed"
      ]
    },
    {
      "class": "Tgov1",
      "ports": {
        "speed": 0,
        "pmech": 1
      },
      "id": "DV2",
      "params": {
        "Trate": 100.0,
        "R": 0.05,
        "T1": 0.5,
        "T2": 2.5,
        "T3": 7.5,
        "Pvmin": 0.0,
        "Pvmax": 1.0,
        "Dt": 0.0
      }
    },
    {
      "class": "Ieeet1",
      "ports": {
        "bus": 0,
        "speed": 0,
        "efd": 2
      },
      "id": "DV3",
      "params": {
        "Tr": 0.0,
        "Ka": 50.0,
        "Ta": 0.04,
        "Ke": -0.06,
        "Te": 0.6,
        "Kf": 0.09,
        "Tf": 1.46,
        "Vrmin": -1.0,
        "Vrmax": 1.0,
        "E1": 2.8,
        "E2": 3.373,
        "Se1": 0.04,
        "Se2": 0.33,
        "Ispdlim": 0.0
      },
      "mon": [
        "efd"
      ]
    }
  ]
}
