{
  "header": {
    "format_version": 0.2,
    "format_revision": 0,
    "case_name": "ThreeBusPartitionedA",
    "case_description": "Partition A: network and GENROU G1; current input at bus 2.",
    "case_comments": ""
  },
  "params": {
    "freq_base": 60.0,
    "va_base": 100000000.0
  },
  "buses": [
    {
      "number": 1,
      "class": "Bus",
      "name": "1",
      "init": {
        "Vr": 1.06,
        "Vi": 0.0
      },
      "params": {
        "kv": 138.0
      }
    },
    {
      "number": 2,
      "class": "Bus",
      "name": "2",
      "init": {
        "Vr": 1.059855349000975,
        "Vi": -0.017511116298558976
      },
      "params": {
        "kv": 138.0
      }
    },
    {
      "number": 3,
      "class": "Bus",
      "name": "3",
      "init": {
        "Vr": 0.9266514121552032,
        "Vi": -0.13812586131957022
      },
      "params": {
        "kv": 138.0
      }
    }
  ],
  "signals": [
    {
      "signal_id": 1,
      "name": "vr"
    },
    {
      "signal_id": 2,
      "name": "vi"
    },
    {
      "signal_id": 3,
      "name": "ir"
    },
    {
      "signal_id": 4,
      "name": "ii"
    }
  ],
  "devices": [
    {
      "class": "Branch",
      "ports": {
        "bus1": 1,
        "bus2": 2
      },
      "id": "BR_0_1",
      "params": {
        "R": 0.05,
        "X": 0.21,
        "G": 0.0,
        "B": 0.1
      }
    },
    {
      "class": "Branch",
      "ports": {
        "bus1": 1,
        "bus2": 3
      },
      "id": "BR_0_2",
      "params": {
        "R": 0.06,
        "X": 0.15,
        "G": 0.0,
        "B": 0.12
      }
    },
    {
      "class": "Branch",
      "ports": {
        "bus1": 2,
        "bus2": 3
      },
      "id": "BR_1_2",
      "params": {
        "R": 0.08,
        "X": 0.27,
        "G": 0.0,
        "B": 0.45
      }
    },
    {
      "class": "LoadZ",
      "ports": {
        "bus": 3
      },
      "id": "load_2_0",
      "params": {
        "R": 0.4447197839297772,
        "X": 0.20330047265361242
      }
    },
    {
      "class": "BusFault",
      "ports": {
        "bus": 3
      },
      "id": "bus_fault_2",
      "params": {
        "R": 0.0,
        "X": 1e-05,
        "state0": false
      }
    },
    {
      "class": "Genrou",
      "ports": {
        "bus": 1
      },
      "id": "genrou_1_1",
      "params": {
        "p0": 1.2502098214505253,
        "q0": 0.33294980345497305,
        "H": 2.7,
        "D": 0.0,
        "Ra": 0.0,
        "Tdop": 7.0,
        "Tdopp": 0.04,
        "Tqopp": 0.05,
        "Tqop": 0.75,
        "Xd": 1.9,
        "Xdp": 0.17,
        "Xdpp": 0.15,
        "Xq": 0.4,
        "Xqp": 0.35,
        "Xqpp": 0.15,
        "Xl": 0.14999,
        "S10": 0.0,
        "S12": 0.0,
        "mva": 200.0
      }
    },
    {
      "class": "BusToSignalAdapter",
      "ports": {
        "bus": 2,
        "vr": 1,
        "vi": 2,
        "ir": 3,
        "ii": 4
      },
      "id": "interface",
      "params": {}
    }
  ]
}
